{
  "required" : true ,
  "$schema" : "http://json-schema.org/draft-03/schema" ,
  "type" : "object" ,
  "properties" : {
    "_id" : {
      "type" : "number" ,
      "required" : false
    } ,
    "created_at" : {
      "type" : "string" ,
      "required" : false
    } ,
    "info" : {
      "type" : "string" ,
      "required" : false
    } ,
    "updated_at" : {
      "type" : "string" ,
      "required" : false
    } ,
    "background" : {
      "type" : "string" ,
      "required" : false
    } ,
    "banner" : {
      "type" : "string" ,
      "required" : false
    } ,
    "logo" : {
      "type" : "string" ,
      "required" : false
    } ,
    "_links" : {
      "type" : "object" ,
      "required" : false ,
      "properties" : {
        "self" : {
          "type" : "string" ,
          "required" : false
        }
      }
    } ,
    "display_name" : {
      "type" : "string" ,
      "required" : false
    } ,
    "name" : {
      "type" : "string" ,
      "required" : false
    }
  }
}