{
  "_id" : 2 ,
  "created_at" : "2011-10-11T23:59:43Z" ,
  "info" : "Team Info" ,
  "updated_at" : "2012-01-15T19:43:40Z" ,
  "background" : "http://static-cdn.jtvnw.net/jtv_user_pictures/team-eg-background_image-089a407eb59fe3b2.png" ,
  "banner" : "http://static-cdn.jtvnw.net/jtv_user_pictures/team-eg-banner_image-8089b058e6ffe4cd-640x125.png" ,
  "logo" : "http://static-cdn.jtvnw.net/jtv_user_pictures/team-eg-team_logo_image-53eaf029dad7d5c9-300x300.png" ,
  "_links" : {
    "self" : "https://api.twitch.tv/kraken/teams/eg"
  } ,
  "display_name" : "Evil Geniuses" ,
  "name" : "eg"
}